{"expressed_confidence":0.6666666666666666,"predictions":[{"expected_observation":"B","falsified_when":"The observed revision differs from the predicted revision.","hypothesis_id":"cache_key_omits_source_revision","test_id":"bypass_caching_proxy"},{"expected_observation":"A","falsified_when":"The observed revision differs from the predicted revision.","hypothesis_id":"worker_reads_stale_source","test_id":"bypass_caching_proxy"},{"expected_observation":"A","falsified_when":"The observed revision differs from the predicted revision.","hypothesis_id":"verifier_reads_stale_artifact","test_id":"bypass_caching_proxy"}],"primary_hypothesis_id":"cache_key_omits_source_revision","public_explanation":"The selected intervention compares preregistered outcomes across all retained causal hypotheses.","retained_hypothesis_ids":["cache_key_omits_source_revision","worker_reads_stale_source","verifier_reads_stale_artifact"],"selected_test_id":"bypass_caching_proxy"}